{
  "dialogue_contents_exported": false,
  "excluded_command_counts": {},
  "map_id": 15,
  "schema_version": "1.0.0",
  "script_bodies_exported": false,
  "sequence_count": 1,
  "sequences": [
    {
      "condition_flags": {
        "self_switch_ch": "A",
        "self_switch_valid": false,
        "switch1_id": 1,
        "switch1_valid": false,
        "switch2_id": 1,
        "switch2_valid": false,
        "variable_id": 1,
        "variable_valid": false,
        "variable_value": 0
      },
      "excluded_command_counts": {},
      "page_index": 0,
      "source_event_id": 1,
      "timeline": [
        {
          "category": "map_transfer",
          "code": 201,
          "indent": 0,
          "parameters": [
            0,
            24,
            12,
            9,
            0,
            1
          ],
          "source_index": 0
        }
      ],
      "trigger": 3
    }
  ],
  "timing": {
    "authority": "RGSS1 default; mkxp.json has no active fixedFramerate override",
    "branching_note": "wait durations are exact per command; do not sum across branches",
    "nominal_frame_duration_ms": 25,
    "nominal_frame_rate": 40,
    "source_unit": "RGSS frames"
  },
  "variant": null,
  "visual_command_counts": {
    "map_transfer": 1
  }
}
