{
  "dialogue_contents_exported": false,
  "excluded_command_counts": {
    "script_commands_redacted": 1
  },
  "map_id": 3,
  "schema_version": "1.0.0",
  "script_bodies_exported": false,
  "sequence_count": 2,
  "sequences": [
    {
      "condition_flags": {
        "self_switch_ch": "A",
        "self_switch_valid": false,
        "switch1_id": 1,
        "switch1_valid": false,
        "switch2_id": 1,
        "switch2_valid": false,
        "variable_id": 1,
        "variable_valid": false,
        "variable_value": 0
      },
      "excluded_command_counts": {},
      "page_index": 0,
      "source_event_id": 1,
      "timeline": [
        {
          "category": "common_event_call",
          "code": 117,
          "indent": 0,
          "parameters": [
            3
          ],
          "source_index": 0
        }
      ],
      "trigger": 1
    },
    {
      "condition_flags": {
        "self_switch_ch": "A",
        "self_switch_valid": false,
        "switch1_id": 60,
        "switch1_valid": true,
        "switch2_id": 1,
        "switch2_valid": false,
        "variable_id": 1,
        "variable_valid": false,
        "variable_value": 0
      },
      "excluded_command_counts": {
        "script_commands_redacted": 1
      },
      "page_index": 0,
      "source_event_id": 2,
      "timeline": [
        {
          "category": "wait",
          "code": 106,
          "indent": 0,
          "parameters": {
            "frames": 24,
            "nominal_ms_at_rgss_40fps": 600
          },
          "source_index": 0
        }
      ],
      "trigger": 3
    }
  ],
  "timing": {
    "authority": "RGSS1 default; mkxp.json has no active fixedFramerate override",
    "branching_note": "wait durations are exact per command; do not sum across branches",
    "nominal_frame_duration_ms": 25,
    "nominal_frame_rate": 40,
    "source_unit": "RGSS frames"
  },
  "variant": "Mie's conflicted copy 2026-01-01",
  "visual_command_counts": {
    "common_event_call": 1,
    "wait": 1
  }
}
